Thử que 2 vạch , chậm kinh 7 ngày , khi nào nên đi khám thai ?	method_diagnosis
Tắc mạch do bị trĩ ngoại phải làm sao ?	treatment
Nên chọn phương pháp nào để xét nghiệm ADN không xâm lấn ?	method_diagnosis
Khi nào lỗ thông liên thất 8mm cần phẫu thuật ?	method_diagnosis
Nổi hạch vùng bẹn liệu có nguy hiểm không ?	severity
Bé không đi cầu được có nên dùng thuốc thụt hậu môn thường xuyên ?	treatment
Ăn vào nôn ra hết kèm dấu hiệu đầy bụng , ợ hơi , nguyên nhân do đâu ?	cause
Phải làm sao khi trẻ chậm phát triển chiều cao ?	treatment
Sau khi đặt 2 viên âm đạo Polidom bị ngứa sưng và nổi mụn đỏ là biểu hiện bệnh gì ?	method_diagnosis
Vòng đầu trẻ 1 tuổi là 51cm liệu có đáng lo ?	severity
Thuốc điều trị bệnh zona có ảnh hưởng đến sữa mẹ không ?	method_diagnosis
Chỉ số chức năng tuyến giáp trong giới hạn bình thường có cần uống thuốc ?	method_diagnosis
Đã điều trị viêm tuyến nước bọt nhưng không đỡ : Cần làm gì ?	treatment
L-Cystein có uống lâu dài được không ?	method_diagnosis
Trẻ có tiền sử thoát vị màng não xuất hiện triệu chứng đau nửa đầu là do đâu ?	cause
Đã tiêm vắc-xin 6 trong 1 của Bỉ có thể tiêm vắc-xin 6 trong 1 của Pháp hay không ?	method_diagnosis
Chỉ số cholesterol và triglycerid của người xơ vữa động mạch tăng giảm như thế nào ?	method_diagnosis
Thai nhi 5 tháng chẩn đoán bị hở hàm ếch xử trí thế nào ?	treatment
Uống thuốc quá liều có sao không ?	severity
Nên làm gì khi có dấu hiệu đột quỵ ?	treatment
Vùng cổ sưng mềm , đau nhức , khó thở có nguy hiểm không ?	severity
Uống thuốc tránh thai khẩn cấp quá liều có ảnh hưởng đến thai nhi không ?	severity
Thai lưu ở tuần 34 khi nào nên mang thai lại ?	method_diagnosis
Bé 4 tuổi đi ngoài khó khăn , phân khuôn to , 2-3 ngày / lần có phải bị phình đại tràng không ?	method_diagnosis
Đau quặn bụng kèm theo cơ thể rã rời là bệnh gì ?	method_diagnosis
Bao quy đầu bị dài , xuất hiện chấm nhỏ ở vành dương vật có nên đi cắt không ?	method_diagnosis
Cổ họng có dịch nhầy , cảm giác bị vướng dấu hiệu bệnh gì ?	method_diagnosis
Nên cho bé ăn dặm thời điểm nào trong ngày là tốt nhất ?	method_diagnosis
Tinh hoàn bên to bên nhỏ liệu có đáng lo ?	severity
Nhận biết trẻ bị tật bàn chân bẹt	method_diagnosis
Dùng miếng dán cao bị sưng ngứa có phải là viêm da kích ứng không ?	method_diagnosis
Sau sinh 3 tháng bị chảy máu hậu môn khi đi ngoài có phải dấu hiệu bệnh trĩ ?	method_diagnosis
Chân bị sưng khi mang thai 3 tháng cuối có ảnh hưởng gì không ?	severity
Tiêm nhắc lại vắc-xin MMR sau bao lâu ?	method_diagnosis
Sốt kèm đau họng là bị bệnh gì ?	method_diagnosis
Bệnh‌ ‌nhân‌ ‌bị‌ ‌vôi‌ ‌hoá‌ ‌thành‌ ‌mạch‌ ‌máu‌ ‌nên‌ ‌ăn‌ ‌uống‌ ‌thế‌ ‌nào ?	method_diagnosis
Mẹ bầu tuần 38 bị nhiễm độc thai nghén phải làm sao ?	treatment
Trẻ sơ sinh khó ngủ , ngủ ít là do đâu ?	cause
Hỏi đáp : Mang thai 5 tháng bị đau ruột thừa viêm cấp nếu mổ gây mê có ảnh hưởng gì không ?	severity
Bổ sung vitamin E với thời gian như thế nào là hợp lý ?	method_diagnosis
Bé bú sữa công thức 800-900 ml liệu có cần bổ sung thêm Vitamin D không ?	method_diagnosis
Đang mang bầu có nhổ răng được không ?	method_diagnosis
Đau nhói vùng bên phải rốn dấu hiệu bệnh gì ?	method_diagnosis
Bị herpes môi có thể cho con bú không ?	method_diagnosis
Hướng dẫn đọc kết quả xét nghiệm mỡ máu	method_diagnosis
Khó di chuyển , khó cầm nắm , không tập trung có nguy cơ mắc bệnh gì ?	method_diagnosis
Sử dụng thuốc kích trứng có ảnh hưởng đến sức khoẻ sinh sản không ?	method_diagnosis
Phương pháp nào được sử dụng trong điều trị trĩ nội độ 3	treatment
Vitamin C có tác dụng gì ?	method_diagnosis
Trẻ sơ sinh hay nghiêng đầu về một bên cảnh báo điều gì ?	method_diagnosis
Trước khi làm IVF nên uống thuốc gì để tăng tỷ lệ thành công ?	treatment
Buồn nôn , đau đầu , đau hốc mắt có phải biểu hiện u tuyến yên ?	method_diagnosis
Đau đầu sau gáy , căng dây chằng khi vận động mạnh hoặc ngồi lâu là bị làm sao ?	method_diagnosis
Tê mỏi tay chân , người bứt rứt , mất ngủ , đổ mồ hôi nên bổ sung vitamin gì ?	treatment
Đau tức ngực , khó thở có phải bệnh lý tim mạch ?	method_diagnosis
Nhói ngực trái khi nuốt kèm ê buốt cánh tay cùng bên là do đâu ?	cause
Đau lưng , tiểu khó , nước tiểu đục là biểu hiện bệnh gì ?	method_diagnosis
Viêm phế quản , khó thở khi ho điều trị như thế nào ?	treatment
26 tuổi huyết áp 77/55 có sao không ?	severity
Uống thuốc tránh thai hàng ngày bị quên vào hôm sau có tác dụng không ?	method_diagnosis
Bé trớ nhiều kèm theo mũi khò khè là bệnh gì ?	method_diagnosis
Trẻ 9 tuổi mắc bệnh hen có nên dùng khí dung khi bé bị ho ?	method_diagnosis
Tinh hoàn phải xệ hơn bên trái có phải sa tinh hoàn ?	method_diagnosis
Trẻ sơ sinh có đờm ở cổ , khó thở có phải bị viêm phế quản không ?	method_diagnosis
Nguyên nhân đau mắt kèm chảy máu ở trẻ sau sinh là gì ?	cause
Thai nhi mắc bệnh tim do lây virus viêm gan B từ mẹ ?	method_diagnosis
Tái phát tắc tuyến lệ sau phẫu thuật thì nên làm gì ?	treatment
Làm sao để khắc phục chứng ảo giác , hay quên ?	treatment
Dấu hiệu chóng mặt khó thở kèm tức ngực buồn nôn cảnh báo bệnh gì ?	method_diagnosis
U bàng quang giai đoạn sớm có thể điều trị khỏi được không ?	treatment
Khó thở , chân tay run dấu hiệu bệnh gì ?	method_diagnosis
Trẻ không phân biệt được màu sắc và ghi nhớ khi học nên làm gì ?	treatment
Trẻ bị lỵ trực trùng nhiễm nấm candida âm đạo nên làm gì ?	treatment
Vô tình nuốt phải dị vật có ảnh hưởng tới hô hấp không ?	severity
Đau bụng do viêm tuỵ mạn điều trị thế nào ?	treatment
Nguy cơ khi sử dụng quá liều thuốc nhuận tràng	severity
Đau vùng đĩa đệm - thắt lưng khi vận động sai tư thế phải làm sao ?	treatment
Phải làm xét nghiệm gì để xác định nhóm máu ?	method_diagnosis
Chế độ dinh dưỡng sau điều trị viêm tuỵ cấp	treatment
Bị Zona thần kinh đã 10 ngày không khỏi phải làm sao ?	treatment
Hai bên miệng tróc vảy khi trời hanh khô là dấu hiệu bệnh gì ?	method_diagnosis
Mỗi lần bé ho là bị đau ngực có phải dấu hiệu của viêm phổi không ?	method_diagnosis
Bị bệnh tim có nên chơi bóng rổ , cầu lông không ?	method_diagnosis
Điều trị chuột rút khi chân đã bị liệt như thế nào ?	treatment
Mang thai tuần thứ 30 tiêm phòng uốn ván có ảnh hưởng gì không ?	severity
Cách cải thiện chứng táo bón sau khi uống cà phê	treatment
Có cần nội soi kiểm tra lại sau khi cắt polyp đại tràng hay không ?	method_diagnosis
Trẻ 12 tuổi bắt đầu dậy thì có quá sớm hay không ?	method_diagnosis
Bệnh Hen có thể điều trị dứt điểm không ?	treatment
Trẻ 1 tháng tuổi sôi bụng , khó đi ngoài và xì hơi là bị làm sao ?	method_diagnosis
Trẻ sinh non ở tuần 32 có nên di chuyển đường xa không ?	method_diagnosis
Trẻ bị động kinh kèm chậm phát triển tâm thần nhẹ cần uống thuốc gì ?	treatment
Phải làm thế nào khi bị viêm tai giữa cấp mủ ?	treatment
Hỏi đáp : Bệnh viêm mao mạch có nguy cơ tái phát không ?	method_diagnosis
Thuốc xịt Nitromint có tác hại nào không ?	severity
Thai nhi bị dị tật ống thần kinh có điều trị được không ?	treatment
Sau chấn thương bắp đùi teo nhỏ , gót chân bị lệch vào trong phải làm sao ?	treatment
Bầm tím ở chân có cần đi xét nghiệm máu không ?	method_diagnosis
Ăn cơm thường xuyên nôn và đau bụng mắc bệnh gì ?	method_diagnosis
Chế độ dinh dưỡng sau khi mổ tim hở như thế nào ?	method_diagnosis
Trẻ 3 tuổi đi tiểu có mùi hôi và tanh là dấu hiệu bệnh gì ?	method_diagnosis
Bé 8 tháng đi ngoài phân sống kéo dài có đáng lo ?	severity
Mắc viêm họng mạn tính , viêm xoang uống thuốc không đỡ nên làm gì ?	treatment
Đau họng , tức ngực là dấu hiệu của bệnh gì ?	method_diagnosis
Gãy xương chày gần 2 tháng vẫn chưa lành là do đâu ?	cause
Ợ hơi , ợ chua , chán ăn khi bị đau dạ dày là sao ?	method_diagnosis
Điều trị viêm da tiết bã như thế nào hiệu quả ?	treatment
Đau rát họng nhiều năm , ho khạc đờm nâu là dấu hiệu bệnh gì ?	method_diagnosis
Nôn và đi ngoài sau phẫu thuật viêm phúc mạc liệu có nguy hiểm ?	severity
Chỉ số PSA trong xét nghiệm máu chẩn đoán tiền liệt tuyến có ý nghĩa gì ?	method_diagnosis
Bị viêm đại tràng co thắt có làm việc nặng được không ?	method_diagnosis
Trẻ bị tăng động giảm chú ý thể nhẹ phải làm sao ?	treatment
Điều trị giãn tĩnh mạch thừng tinh như thế nào ?	treatment
Tiêm 6 trong 1 có cần phải uống vắc-xin bại liệt nữa không ?	method_diagnosis
Tăng Triglycerid nên sử dụng thuốc nào giúp hỗ trợ điều trị ?	treatment
Phá thai 1 tuần bằng thuốc gì ?	treatment
Xuất hiện phần thịt ở dưới hậu môn có phải dấu hiệu bệnh trĩ ?	method_diagnosis
Răng thưa và hôi miệng khắc phục thế nào ?	treatment
Bị thuỷ đậu đã khỏi nhưng cảm giác thị lực giảm là do đâu ?	cause
Muốn biết nguyên nhân gây hẹp máu não thì dùng xét nghiệm gì ?	method_diagnosis
Đại tiện ra máu tươi nhỏ giọt là dấu hiệu của bệnh lý gì ?	method_diagnosis
Điều trị suy nút xoang như thế nào ?	treatment
Bé 4 tháng hay nằm nghiêng bên phải liệu có đáng lo ?	severity
Trẻ sơ sinh đi ngoài phân xanh đen có sao không ?	severity
Mắc bệnh lao không kháng thuốc có nên dùng thực phẩm bổ gan ?	method_diagnosis
Nên làm gì khi trẻ sơ sinh 2 tháng tuổi đã đóng thóp ?	treatment
Đo nhãn áp bằng độ lõm giác mạc điện tử và bằng khí kết quả nào chính xác hơn ?	method_diagnosis
Sau tiêm mũi 2 viêm não Nhật Bản trẻ sốt , nôn trớ , đi ngoài nhiều lần thì có nguy hiểm không ?	severity
Trẻ 15 tháng đi ngoài mấy lần 1 ngày là bình thường ?	method_diagnosis
Tức ngực , khó thở , buồn nôn , ợ hơi cảnh báo điều gì ?	method_diagnosis
Đau bụng dưới kèm đau chân cảnh báo bệnh gì ?	method_diagnosis
Sự phát triển ở trẻ 4 tháng tuổi	method_diagnosis
Trẻ uống thuốc điều trị bệnh viêm phổi không đỡ , phải làm sao ?	treatment
Người huyết áp thấp có nên làm việc ngoài trời ?	method_diagnosis
Trẻ sốt đi sốt lại 40 độ liên tục trong 1 tuần , người rét run , nóng ran và môi khô cảnh báo bệnh lý gì ?	method_diagnosis
Bị sỏi niệu quản 8mm , thận ứ nước độ 2 gây đau quặn , uống thuốc không khỏi phải làm sao ?	treatment
Bị lệch xương hàm cần điều trị thế nào ?	treatment
Đau ngực , chán ăn , mệt mỏi là dấu hiệu bệnh gì ?	method_diagnosis
Nổi hạch vùng bẹn , đau và chảy mủ là bị làm sao ?	method_diagnosis
Thiếu canxi máu nên làm gì ?	treatment
Nhức đầu do bị u nang vòm mũi có được giảm đau bằng thuốc Panadol không ?	treatment
Có phải ăn socola bị mất ngủ không ?	method_diagnosis
Phần lợi răng hàm bị sưng , xuất hiện vệt trắng là bị làm sao ?	method_diagnosis
Đau ngực phải , nặng lồng ngực phải , khó thở nguy cơ mắc bệnh gì ?	method_diagnosis
Làm thế nào để biết mình đang có dị vật khớp gối , thưa bác sĩ ?	method_diagnosis
Độ mờ da gáy 12 tuần 6 ngày 2,5 mm có bình thường không ?	severity
Người cao tuổi xuất hiện triệu chứng đau đầu chóng mặt , huyết áp cao	method_diagnosis
Vết khâu tầng sinh môn bị rách có khâu lại được không ?	treatment
Trẻ 3 tuổi mắc bệnh tan máu bẩm sinh có thể cấy tế bào gốc được không ?	method_diagnosis
Cơ thể lúc nóng lúc lạnh không đáp ứng thuốc hạ sốt có đáng lo ?	severity
Mắc bệnh tiểu đường , máu nhiễm mỡ kèm theo viêm tuỵ có nguy hiểm không ?	severity
Lỗ rò luân nhĩ sưng đỏ , đã rạch mủ liệu có thể phẫu thuật không ?	treatment
Trẻ bị chốc lở bôi kem gì nhanh khỏi ?	treatment
Đau bụng , ợ hơi , tiêu chảy là dấu hiệu của bệnh lý gì ?	method_diagnosis
Bé hay ngạt mũi , sổ mũi điều trị như thế nào ?	treatment
Mất kinh 2 tháng kèm theo xuất hiện khí hư màu nâu là dấu hiệu bệnh gì ?	method_diagnosis
Kiểm tra vết va đập xương ống chân bằng cách nào ?	method_diagnosis
Viêm xoang trán có điều trị dứt điểm được không ?	treatment
Bảng tham chiếu có phải tiêu chuẩn bắt buộc để lưu trữ máu cuống rốn không ?	method_diagnosis
Trẻ sơ sinh đóng thóp sớm liệu có nguy hiểm không ?	severity
Thi thoảng bé ho , không sốt là sao ?	method_diagnosis
Cơ cắn bị phì đại do tật nghiến răng phải làm sao ?	treatment
Bé ngủ không sâu giấc nên xử lý ra sao ?	treatment
Trẻ 6 tháng đi ngoài phân sống điều trị như thế nào ?	treatment
Lưỡi xuất hiện nhiều mụn đỏ , có niềng răng là dấu hiệu bệnh gì ?	method_diagnosis
Viên sỏi túi mật khoảng 10-13 mm có khả năng rơi vào cổ túi mật , ống mật chủ gây tắc mật không ?	method_diagnosis
Những trường hợp nào không được điều trị ghép tế bào gốc ?	method_diagnosis
Bị bệnh rối loạn phân ly có uống thuốc Tây được không ?	treatment
Bị đau nửa đầu có nên tiếp tục uống thuốc hoạt huyết dưỡng não không ?	treatment
Bé gái lớp 4 xuất hiện kinh nguyệt có nên tiêm hormon kìm hãm dậy thì sớm ở trẻ không ?	method_diagnosis
Có dùng enterogermina khi đang uống thuốc lao được không ?	method_diagnosis
Ra máu và dịch màu nâu khi mang thai liệu có đáng lo ?	severity
Chưa đủ 18 tuổi có thể tiến hành trồng răng được không ?	method_diagnosis
Phơi nhiễm là gì ?	method_diagnosis
Chỉ số ROMA 37,32% có phải bị ung thư buồng trứng không ?	method_diagnosis
Gây mê một phần với gây mê toàn thân khác nhau thế nào ?	method_diagnosis
Nên cấy que tránh thai lần 2 khi nào và ở đâu ?	method_diagnosis
Trẻ 5 tuổi bị giun kim gây ngứa hậu môn nên điều trị thế nào ?	treatment
Có khả năng mang thai sau khi uống thuốc tránh thai khẩn cấp hay không ?	method_diagnosis
Có nên gây tê ngoài màng cứng khi chuyển dạ không ?	method_diagnosis
Khoảng cách uống hai hộp canxi corbiere là bao lâu ?	method_diagnosis
Bé gái mắc bệnh Hirschsprung di truyền có cao không ?	method_diagnosis
Xét nghiệm đánh giá chức năng thận	method_diagnosis
Giãn tĩnh mạch thừng tinh 3,4 mm là ở mức nào ?	method_diagnosis
Tại sao mất ngủ lại tăng cân ?	cause
Đau tức ngực kèm khó thở có phải là dấu hiệu của bệnh tim ?	method_diagnosis
Trẻ sốt li bì do viêm đường hô hấp trên có nguy hiểm ?	severity
Đùi và bàn chân của trẻ bé quá so với người liệu có sao không ?	severity
Họng viêm loét kèm theo đau rát là triệu chứng của bệnh gì ?	method_diagnosis
Mất thị lực do biến chứng đái tháo đường có khả năng cứu chữa không ?	treatment
Trẻ đi lại tập tễnh nhưng chân không đau là do đâu ?	cause
Ra khí hư bất thường , ngứa âm đạo cảnh báo bệnh lý gì ?	method_diagnosis
Gaviscon có phải là thuốc nhóm ức chế bơm proton PPIs không ?	method_diagnosis
Giãn đài bể thận phải , niệu quản đôi cấp độ 3 đã phẫu thuật cắt bỏ túi tịch nhưng tái phát phải điều trị thế nào ?	treatment
Bị đau đầu do u não có nghiêm trọng không ?	severity
Nên làm gì khi trẻ 2 tuổi bị trướng bụng , khó đi ngoài ?	treatment
Thai 20 tuần có đình chỉ thai nghén được không ?	method_diagnosis
Hở van 2 lá 2.5/4 , hở van 3 lá 1.5/4 có cần phẫu thuật tim không ?	method_diagnosis
Tại sao uống thuốc tránh thai khẩn cấp gây xuất huyết âm đạo ?	cause
Khó thở , ho khan được chẩn đoán suy tim nên làm gì ?	treatment
Đầy bụng , khó tiêu , buồn đi vệ sinh sau ăn kèm đau bụng dưới là bệnh gì ?	method_diagnosis
Đọc kết quả xét nghiệm máu chẩn đoán bệnh alpha thalassemia	method_diagnosis
Đau cổ phía sau gáy biểu hiện bệnh gì ?	method_diagnosis
Đau nhói ngực nhẹ , bóng tim hơi to liệu có vấn đề gì không ?	severity
Đọc ý nghĩa chỉ số đường huyết của bà bầu tuần 32	method_diagnosis
Thưa bác sĩ , bệnh sa tạng chậu có những dấu hiệu nhận biết nào ạ ?	method_diagnosis
Triệu chứng lõm ngực ở người lớn có nên phẫu thuật ?	method_diagnosis
Bị trễ kinh nguyệt 3 tháng ăn uống thế nào để cải thiện ?	treatment
Chu kỳ kinh nguyệt đến sớm sau uống thuốc tránh thai báo hiệu điều gì ?	method_diagnosis
Đi tiểu nhiều , tiểu buốt khi mang thai là dấu hiệu bệnh gì và điều trị như thế nào ?	method_diagnosis
Mắc thoát vị khe trượt thực quản có cần phải mổ không ?	method_diagnosis
Ho nhiều dẫn đến đau nửa đầu và mắt có sao không ?	severity
Vết thương chảy máu khi chưa được sát trùng , phải làm sao ?	treatment
Bệnh gan tăng âm nhẹ có nguy hiểm không ?	severity
Trẻ sơ sinh thở khò khè phải làm sao ?	treatment
Mang thai 6 tuần có điều trị viêm bằng thuốc đặt được không ?	treatment
Bệnh viện Vinmec có khám và chữa dứt bệnh hen phế quản cho bé được không ?	treatment
Nhận diện dấu hiệu bệnh sốt rét	method_diagnosis
Có thể điều trị khỏi viêm gan B bằng thuốc kháng sinh không ?	treatment
Cổ họng khó chịu , nổi cục , thỉnh thoảng bao tử ợ chua nên dùng thuốc gì ?	treatment
Thai 27 tuần xuất hiện cơn gò tử cung có phải dấu hiệu sinh sớm ?	method_diagnosis
Xuất hiện hạch sau tai có đáng lo không ?	severity
Trẻ 9 tháng tuổi sợ ăn dặm phải làm sao ?	treatment
Vì sao trẻ khó ngủ vào ban đêm ?	cause
Buồn nôn , khó thở , đau thắt ngực có phải dấu hiệu nhồi máu cơ tim ?	method_diagnosis
Chỉ số Prolactin tăng cao có nguy hiểm không ?	severity
Trẻ sơ sinh khó đi ngoài do đâu ?	cause
Thai nhi 19 tuần xuất hiện đa ối có ảnh hưởng đến sự phát triển không ?	severity
Bị túi thừa bàng quang có thuốc nào điều trị không ?	treatment
Có thể tiêm ngừa dại ở đâu trong tp.HCM ?	method_diagnosis
Cơ chế tác dụng của thuốc maxitrol như nào vậy ạ ?	method_diagnosis
Hôi miệng kinh niên có trị dứt điểm được không ?	treatment
Ra huyết trắng không hôi , không ngứa có bình thường không ?	severity
Mất cảm giác , hoa mắt đau đầu là dấu hiệu của bệnh gì ?	method_diagnosis
Làm việc trên máy tính và tiếp xúc sóng wifi nhiều có phải nguyên nhân dẫn đến khó thụ thai ?	cause
Chỉ số Creatinin là 1.5 bị suy thận độ mấy ?	method_diagnosis
Ngủ sớm có hết thâm mắt không ?	method_diagnosis
Trẻ 10 tháng nặng 12kg , dài 77cm có bị còi xương không ?	method_diagnosis
Ra máu , mỏi người sau uống thuốc tránh thai khẩn cấp liệu có bầu không ?	method_diagnosis
Đốt sùi mào gà sâu bên trong hậu môn bằng cách nào ?	treatment
Thường xuyên bị chóng mặt có phải là dấu hiệu bệnh lý không ?	method_diagnosis
Quan hệ tình dục với người nghi nhiễm HIV liệu có khả năng lây bệnh không ?	method_diagnosis
Lang ben vùng mặt có chữa khỏi được không ?	treatment
Bé trễ lịch tiêm vắc-xin 6 trong 1 quá lâu có sao không ?	severity
Sau sinh 6 tuần xuất tinh ngoài có thai không ?	method_diagnosis
Tê tay có phải tác dụng phụ của thuốc huyết áp Amlor không ?	method_diagnosis
Xoang mãn tính lâu năm nên điều trị thế nào ?	treatment
Phải làm sao khi uống thuốc trị táo bón không khỏi ?	treatment
Tiêm 2 mũi vắc-xin 6 trong 1 gần nhau có nguy hiểm không ?	severity
Sau khi lột bao quy đầu bị đau có sao không , cách khắc phục hiệu quả ?	treatment
Hỏi đáp : Trẻ 3 tháng bên trong tai có mùi hôi , ướt điều trị như thế nào ?	treatment
Bé dùng kháng sinh hết đi ngoài lại bị táo bón liệu có nên dừng hay không ?	method_diagnosis
Triệu chứng viêm phế quản , hen suyễn ở người già	method_diagnosis
Ra máu “ vùng kín ” bất thường có sao không ?	severity
Thường xuyên đau bụng kèm hiện tượng cắn rát , nguyên nhân là gì ?	cause
Thời điểm uống thuốc điều trị vi khuẩn HP tốt nhất là khi nào ?	method_diagnosis
Thỉnh thoảng đau nhói đầu là dấu hiệu bệnh gì ?	method_diagnosis
Xuất hiện tình trạng rỉ máu sau phẫu thuật điều trị lạc nội mạc tử cung	treatment
Chiều cao của trẻ bị thấp hơn so với tuổi , cần làm gì ?	treatment
Mẹ bầu thiếu máu hồng nhỏ có thể lưu trữ máu cuống rốn của con không ?	method_diagnosis
Khi nào cần đưa trẻ đi khám trầm cảm ?	method_diagnosis
Dấu hiệu chướng bụng , ăn không tiêu , đau dạ dày có nguy hiểm ?	severity
Ù và đau tai kéo dài , nghe kém kèm đau đầu là do đâu ?	cause
Đau rát tay chân , người uể oải có phải dấu hiệu nhiễm thuỷ ngân trong chất hàn răng không ?	method_diagnosis
Vết khâu tầng sinh môn như thế nào là hồi phục ?	method_diagnosis
Tuần thứ 11 nhịp tim thai nhi 168 l / phút có phải mang thai con gái ?	method_diagnosis
Đau nhói hai bên ngực lan xuống tay là dấu hiệu bệnh gì ?	method_diagnosis
Điều trị xuất huyết não bằng cách nào ?	treatment
Vắc-xin 6 trong 1 của Pháp chất lượng có tốt không ?	method_diagnosis
Chậm tăng cân , uống sữa công thức không bị nổi mề đay , tiêu chảy có phải dị ứng đạm sữa bò ?	method_diagnosis
Vết khâu tử cung vẫn đau sau 20 ngày có sao không ?	severity
Bé gái 7 tuổi phát triển ngực có phải là dấu hiệu của dậy thì sớm ?	method_diagnosis
Phụ nữ mang thai có dùng thuốc xịt mũi được không ?	method_diagnosis
Dị vật chui vào tai gây đau có nguy hiểm không ?	severity
Chỉ số xét nghiệm máu như thế nào xác định bệnh tan máu bẩm sinh ?	method_diagnosis
Tiêm vắc-xin cúm khi mang thai	method_diagnosis
Trẻ thở khò khè trong khi ngủ có nguy hiểm không ?	severity
Bệnh bại não có thể điều trị được không ?	treatment
Trẻ có khả năng bị nghe kém nếu test thính lực không đạt không ?	method_diagnosis
Kết quả xét nghiệm máu gót chân HBE 2.6 có nguy hiểm không ?	severity
Được chẩn đoán viêm dạ dày tá tràng , đã uống thuốc nhưng không đỡ phải làm sao ?	treatment
Trẻ 5 tuổi thường khó ngủ có nguy cơ mắc bệnh gì không ?	method_diagnosis
Tim đập nhanh có phải do thiếu máu không ?	cause
Bé có nên đi cắt amidan khi bị viêm A không ?	method_diagnosis
Làm thế nào để phân biệt ho do viêm phổi và do trào ngược dạ dày - thực quản ?	method_diagnosis
Cần làm gì để phục hồi sau chấn thương sọ não ?	treatment
Vì sao bị nghẹt mũi khó thở kèm theo sổ mũi kéo dài ?	cause
Bị mèo cắn chảy máu có cần đi chích ngừa phòng dại không ?	method_diagnosis
Làm sao để khắc phục tình trạng đi ngoài không tự chủ ?	treatment
Trẻ nổi mụn nước gây ngứa là bệnh gì ?	method_diagnosis
Nên sử dụng thuốc bôi nào để bớt ngứa do viêm da ?	treatment
Trẻ bị nhiễm trùng huyết để lại di chứng tổn thương não phục hồi thế nào ?	treatment
