Điều trị hội chứng ruột kích thích như thế nào ?	treatment
Trẻ xuất hiện chấm đỏ dưới da là bị sao ?	method_diagnosis
Có đáng lo khi chỉ số TSH là 0.213 uIU / ml ?	severity
Bị đau răng khôn và sưng ở cổ có nguy hiểm không ?	severity
Chỉ nhìn đường nửa mắt , nguyên nhân do đâu ?	cause
Rụng tóc từng mảng , đã mọc lại rụng tiếp là dấu hiệu của bệnh gì ?	method_diagnosis
Bé 15 ngày tuổi bị són phân nhiều lần trong ngày có sao không ?	severity
Tiểu rắt , nước tiểu màu xanh sau khi mới phá thai có sao không ?	severity
Tôi hay chơi thể thao và thường xuyên bị chấn thương , tôi muốn hỏi cách phòng tránh chấn thương thể thao ?	treatment
Trẻ 16 tuổi thường xuyên giật mình khó ngủ có đáng lo ?	severity
Bị rối loạn cảm xúc , ám ảnh phải làm sao ?	treatment
Trẻ sơ sinh đi phân màu xanh có bọt là bị sao ?	method_diagnosis
Viêm da do sử dụng thuốc corticoid có thể điều trị không ?	treatment
Xét nghiệm PCR âm tính virus HPV có bị sùi mào gà hay không ?	method_diagnosis
Trẻ 16 tháng bị giun sán có sổ được không ?	method_diagnosis
Mẹ bầu bị trĩ giai đoạn 3 có can thiệp điều trị được không ?	treatment
Nước tiểu cặn có phải do hẹp bao quy đầu không ?	cause
Hay bị đánh trống ngực , khó thở , giật mình có phải do bệnh tim mạch ?	cause
Có được đi cùng chồng đến lớp học tiền sản không ?	method_diagnosis
Trẻ 18 tháng tuổi khó lên cân nên khám gì ?	method_diagnosis
Sản phẩm Acid Folic nào tốt nhất trên thị trường hiện nay ?	method_diagnosis
Khó cương dương sau cắt dây thần kinh lưng thực vật là do đâu ?	cause
Ra máu âm đạo sau khi uống thuốc tránh thai khẩn cấp liệu có nguy hiểm ?	severity
Uống thuốc điều trị trầm cảm mất ngủ thời gian dài có gây đau nhức cơ thể không ?	severity
Trẻ sơ sinh tiêu chảy khi nào cần khám chuyên khoa tiêu hoá ?	method_diagnosis
Làm thế nào để vỗ lưng ợ hơi cho bé đúng cách ?	treatment
Thuốc điều trị bệnh thương hàn nên dùng loại nào ?	treatment
Khó đi ngoài là triệu chứng của bệnh gì ?	method_diagnosis
Thóp đóng là như thế nào ?	method_diagnosis
Gãy xương đòn có gây ra hiện tượng mỏi bả vai không ?	method_diagnosis
24 tuổi chưa dậy thì , phải làm thế nào ?	treatment
Đau buốt hàm sau khi nhổ răng số 8 có đáng lo không ?	severity
Trẻ xuất hiện nôn kèm sốt nhẹ và đi ngoài là mắc bệnh gì ?	method_diagnosis
Chu kỳ kinh nguyệt kéo dài 35 ngày có sao không ?	severity
Sau khi tiêm phòng phế cầu liệu viêm tai giữa có tái phát không ?	method_diagnosis
Cần phải làm gì để cải thiện cân nặng cho trẻ sinh non ?	treatment
Trẻ sơ sinh 3 ngày tuổi đi ngoài 5 đến 7 lần một ngày có sao không ?	severity
Uống thuốc điều trị rối loạn tiêu hoá không hết phải làm sao ?	treatment
“ Vùng kín ” bé bị đau và có mùi phải làm sao ?	treatment
Trẻ bị tổn thương chất trắng ở não , phải làm sao ?	treatment
Khi bị nhện cắn phải xử lý như thế nào cho đúng ?	treatment
Hỏi đáp : Bệnh mất trí nhớ hoàn toàn thoáng qua nên uống thuốc gì ?	treatment
Nên làm gì khi đang điều trị suy giáp phát hiện có thai ?	treatment
Viêm tuỵ cấp diễn biến ra sao và nên điều trị ở đâu ?	treatment
Nên ăn gì và kiêng ăn gì khi Testosterone giảm ?	method_diagnosis
Thường xuyên đau đầu dữ dội là do đâu ?	cause
Bác sĩ cho tôi hỏi : Điều trị u máu não mất bao lâu ạ ?	treatment
Trẻ mắc bệnh lồng ruột nên điều trị thế nào ?	treatment
Đau đầu dữ dội khi mang thai phải làm sao ?	treatment
Điều trị tăng tiết mồ hôi tay chân như thế nào ?	treatment
Trẻ lỡ 1 lần uống vitamin A có cần uống bù không ?	method_diagnosis
Đầu óc trống rỗng , sa sút trí tuệ cảnh báo bệnh gì ?	method_diagnosis
Mất ngủ có chữa được không ?	treatment
Phế Đan có phải sản phẩm hỗ trợ điều trị bệnh lao hiệu quả không ?	method_diagnosis
Chế độ ăn sau sinh của mẹ có trong chương trình thai sản trọn gói hay không ?	method_diagnosis
Bé sinh non chưa mọc răng nhưng phát triển bình thường liệu có sao không ?	severity
Phân có váng mỡ khi uống thuốc điều trị dạ dày có sao không ?	severity
Bé gái 9 tuổi ngực phát triển , mọc lông mu có phải dấu hiệu dậy thì sớm ?	method_diagnosis
Đặt túi nâng ngực có chip thực hiện chụp MRI được không ?	method_diagnosis
Teo C2 dạ dày có bị ung thư không ?	method_diagnosis
Đã tiêm huyết thanh và vắc-xin 5 trong 1 có cần tiêm thêm mũi viêm gan B đơn không ?	method_diagnosis
Thường xuyên đau đỉnh đầu là dấu hiệu của bệnh gì ?	method_diagnosis
Uống thuốc điều trị viêm loét dạ dày tá tràng nhiều lần không khỏi phải làm sao ?	treatment
Uống thuốc điều trị hạch cổ không khỏi , tái sưng kèm đau có đáng lo ?	severity
Thời gian thực hiện kỹ thuật nội soi gây mê nên cách nhau bao lâu ?	method_diagnosis
Triệu chứng cảnh báo viêm thanh quản cấp	method_diagnosis
Viêm kết mạc dị ứng có thể chữa dứt điểm không ?	treatment
Thường xuyên đau lưng là do đâu ?	cause
Trẻ dưới 2 tháng tuổi có nên bổ sung DHA ?	method_diagnosis
Bệnh nhân tự ý rút ống sonde dạ dày có thể dẫn đến tử vong không ?	severity
Trẻ xuất hiện mẩn đỏ và sưng ở ngực có phải u máu không ?	method_diagnosis
Có nên truyền nước , truyền đạm với người lên cơn mệt tim không ?	method_diagnosis
Ho kéo dài cảnh báo bệnh lý gì ?	method_diagnosis
Trẻ uống vắc-xin Rota bị nôn có cần uống lại không ?	method_diagnosis
Dấu hiệu ù tai , bước đi không vững cảnh báo bệnh gì ?	method_diagnosis
Răng hàm dưới xuất hiện dãy sụn cứng có nguy hiểm không ?	severity
Nhiễm sán chó khi mang thai có ảnh hưởng đến thai nhi không ?	severity
Kết quả đo điện não đồ giấc ngủ nói lên điều gì ?	method_diagnosis
Suy giãn tĩnh mạch sâu chi dưới điều trị bằng thuốc gì ?	treatment
Cải thiện chức năng hệ tĩnh mạch chi dưới như thế nào ?	treatment
Có chấm đỏ tại bộ phận sinh dục là dấu hiệu bệnh gì ?	method_diagnosis
Triệu chứng đau đầu ngực cảnh báo bệnh lý gì ?	method_diagnosis
Áp xe hậu môn tự vỡ liệu có bị rò hậu môn không ?	method_diagnosis
Viêm gan B có chữa khỏi hoàn toàn không ?	treatment
17 tuổi uống Glutathione 1000 mg / ngày làm trắng da có an toàn không ?	severity
Phản ứng sau khi uống thuốc tránh thai khẩn cấp	method_diagnosis
Bé thường xuyên trớ sữa có nên cho uống men vi sinh không ?	method_diagnosis
Có nên khám thai dưới 4 tuần tuổi không ?	method_diagnosis
Trẻ sơ sinh ngủ li bì kéo dài 5-6 tiếng không dậy bú có sao không ?	severity
Ngứa âm đạo xuất hiện khí hư là bệnh gì ?	method_diagnosis
Đau nhức mắt khi nhìn ánh sáng có nguy hiểm không ?	severity
Khi đi đại tiện hậu môn xuất hiện bóng sau là bị bệnh gì ?	method_diagnosis
Trẻ 5 tuổi lở ở đầu lưỡi , lòng bàn tay có vài mụn nước có phải triệu chứng của bệnh chân tay miệng không ?	method_diagnosis
Niêm mạc tử cung dày bao nhiêu là có khả năng thụ thai ?	method_diagnosis
Trẻ 12 tuổi phát triển ngực , mọc lông mu có phải dậy thì sớm không ?	method_diagnosis
Hỏi đáp : Phác đồ điều trị lao tái phát như thế nào ?	treatment
Trẻ bị vùi dương vật bẩm sinh có thể khám ở khoa nào ?	method_diagnosis
Cơ địa dị ứng khi gây mê cần lưu ý những gì ?	method_diagnosis
Xuất tinh ngoài , thử que 1 vạch nhưng chậm kinh có phải do mang thai không ?	method_diagnosis
Cơ chế gây bệnh Kwashiorkor là gì ?	cause
Trẻ em trên 5 tuổi có mắc bệnh tay chân miệng không ?	method_diagnosis
Trẻ 33 tháng mọc 15 răng có bị chậm mọc răng không ?	method_diagnosis
Sau 2 tháng mổ thông vòi trứng có thể bơm IUI được không ?	method_diagnosis
Hỏi đáp : Tìm hiểu về bệnh suy tim là gì ?	method_diagnosis
Đi sinh tại Vinmec , người nhà có được ở lại chăm sóc sản phụ không ?	method_diagnosis
Trẻ 2 tuần tuổi thiếu men G6PD nên điều trị thế nào và cần tránh những gì ?	treatment
Trẻ 1,5 tháng đi ngoài phân lỏng , có bọt kèm sợi máu có sao không ?	severity
Tiền sử co giật khi ốm , khi lớn lên chậm chạp có phải dấu hiệu bệnh lý không ?	method_diagnosis
Phác đồ điều trị bệnh ho kéo dài uống thuốc không khỏi là gì ?	treatment
Thai nhi bị suy dinh dưỡng trong bụng mẹ cần duy trì chế độ ăn uống như thế nào ?	treatment
Trẻ 2 tháng tuổi uống Vitamin D3 một lượng bao nhiêu là phù hợp ?	method_diagnosis
Lời khuyên nào dành cho bệnh nhân đã điều trị ung thư thành công ?	treatment
Cách tăng chiều cao cho trẻ dậy thì sớm	treatment
Khó thở , tức ngực , nghẹn và đau sưng quanh cổ cảnh báo bệnh lý gì ?	method_diagnosis
Có nên cho trẻ đi tiêm vắc-xin thuỷ đậu khi đang dịch bệnh không ?	method_diagnosis
Chỉ số HBsAb là 92 có cần tiêm phòng vắc-xin viêm gan B nữa không ?	method_diagnosis
Làm gì nếu trẻ bị tiêu chảy khi dùng kháng sinh điều trị viêm phế quản ?	treatment
Trẻ 10 tuổi bị chó cắn có cần tiêm vắc-xin phòng dại không ?	treatment
Tại sao phải kiêng đạm và đường khi bị ung thư ?	method_diagnosis
Các hạch di động ở gáy , sau tai , cổ có kích thước to dần liệu bình thường không ?	severity
Quan hệ nhiều lần mà vẫn chưa có thai ?	method_diagnosis
Trẻ 8 tháng tăng cân chậm nên bổ sung thuốc gì ?	treatment
Hỏi đáp : Hình ảnh nội soi đại tràng phát hiện bệnh gì ?	method_diagnosis
Đang tiêm vắc-xin 6 trong 1 chuyển sang tiêm 5 trong 1 được không ?	method_diagnosis
Điều trị viêm dạ dày Hp trong bao lâu thì khỏi hoàn toàn ?	treatment
Trẻ đã tiêm chủng đầy đủ , khi tiếp xúc với người bệnh lao có nguy cơ nhiễm bệnh không ?	severity
Hen phế quản mãn tính có điều trị dứt điểm được không ?	treatment
Sau tán sỏi bị gan mờ , đau cột sống nên dưỡng gan và cột sống thế nào ?	treatment
Bé bị ngã chảy máu đầu , chụp CT không sao nhưng sốt liệu có phải nhiễm trùng không ?	method_diagnosis
Sưng đỏ da và co rút ngón tay sau khi điện giật có phải là tình trạng bỏng không ?	method_diagnosis
Tai biến mạch não lâu ngày có thể điều trị bằng ghép tế bào gốc được không ?	treatment
Xét nghiệm máu có phát hiện vi khuẩn HP hay không ?	method_diagnosis
Trẻ khó đại tiện , phân có nhiều máu tươi nhiều là bị bệnh gì ?	method_diagnosis
Uống thuốc điều trị lao trong 6 tháng có bị rối loạn tiêu hoá không ?	method_diagnosis
Hỏi đáp : Trẻ nổi mẩn đỏ có phải do dị ứng đạm sữa bò không ?	method_diagnosis
Đại tràng có tổn thương dạng LSTs đường kính 10-15 mm nghĩa là gì ?	method_diagnosis
Nước mũi màu nâu hoặc vàng tươi dạng lỏng có sao không ?	severity
Viêm xoang ở trẻ em có thể chữa khỏi không ?	treatment
Trẻ mắc bệnh thalassemia ghép tế bào gốc thì tuỷ răng người thân có hợp không ?	method_diagnosis
Chỉ số Beta HCG là 5.588 U / L thai được mấy tuần ?	method_diagnosis
Điều trị u nang hạ họng thanh thiệt khi nào tốt nhất ?	treatment
Trẻ bị đau mắt , sưng tấy mi dưới , mắt xuất huyết trong có đáng lo ?	severity
Sau điều trị u nhọt trẻ bị sốt , sưng mặt là bị sao ?	method_diagnosis
Thoái hoá võng mạc là biến chứng của tiểu đường ?	method_diagnosis
Xét nghiệm HIV AB miễn dịch tự động tại Vinmec là gì ?	method_diagnosis
Mang thai sau khi điều trị ung thư vú liệu có sao không ?	severity
Nước ối bẩn do thai nhi đi phân su có nguy hiểm không ?	severity
Đau ngực và lưng sau chu kỳ kinh nguyệt có phải dấu hiệu mang thai ?	method_diagnosis
Trẻ 15 tháng tuổi bị rụng tóc từ tháng thứ 8 vẫn chưa mọc lại là bị làm sao ?	method_diagnosis
Bé đã tiêm vitamin K , dùng LineaBon K 2 + D 3 có bị thừa không ?	method_diagnosis
10 tuổi xuất hiện kinh nguyệt có được gọi là dậy thì sớm ?	method_diagnosis
Phương pháp điều trị thiếu men G6DP ở trẻ như thế nào ?	treatment
Người hay mệt mỏi , khó thở , thở gấp do rối loạn thần kinh thực vật hay hở van tim gây nên ?	cause
Thai nhi tuần 31 nặng 1466g có đáng lo ?	severity
Giãn tĩnh mạch có điều trị được bằng phương pháp phẫu thuật và laser không ?	treatment
Vắc-xin phòng bệnh bạch hầu có an toàn không ?	method_diagnosis
Vệ sinh răng miệng sạch sẽ nhưng tình trạng hôi miệng không dứt ?	cause
Trẻ mới sinh hay ướt mắt có nguy hiểm không ?	severity
Mắt bị viêm kết mạc sợi cần tránh những gì ?	method_diagnosis
Dùng thuốc điều trị động kinh phenobarbital có ảnh hưởng đến sinh sản không ?	method_diagnosis
Nguyên nhân trẻ sơ sinh táo bón là do đâu ?	cause
Chỉ số xét nghiệm chức năng gan và mỡ máu thế nào là bình thường ?	method_diagnosis
Nhịp tim và huyết áp ở mức nào là bình thường ?	method_diagnosis
Sử dụng thuốc điều trị lao đúng cách	treatment
Cảm giác tiểu không hết là bị bệnh gì ?	method_diagnosis
Bệnh nhân gãy cột sống phải bắt vít có thể phục hồi chức năng được không ?	method_diagnosis
Vị trí của cột sống nằm ở đâu ?	method_diagnosis
Nên chụp CT hay siêu âm để chẩn đoán sỏi thận ?	method_diagnosis
Viêm màng não có để lại di chứng không ?	method_diagnosis
Phương pháp phẫu thuật đặt ống thông bàng quang có để lại biến chứng gì không ?	method_diagnosis
Kết quả xét nghiệm nước tiểu đánh giá sức khoẻ như thế nào ?	method_diagnosis
Sùi mào gà ở vùng kín có điều trị khỏi không ?	treatment
Trẻ 28 tháng tuổi nạo VA được không ?	method_diagnosis
Viêm mũi vận mạch và viêm mũi dị ứng có điều trị dứt điểm được không ?	treatment
Ho khan không đờm , ngạt mũi một bên có phải dấu hiệu ung thư vòm họng không ?	method_diagnosis
Trào ngược dạ dày tái phát có nguy hiểm không ?	severity
Trẻ 15 tháng bị thiếu máu nhẹ có cần làm thêm xét nghiệm điện di huyết sắc tố không ?	method_diagnosis
Trẻ học lớp 5 bị ra huyết trắng thì có sao không ?	severity
Bệnh viêm loét dạ dày có thể chữa khỏi hoàn toàn được không ?	treatment
Bé có khối thịt ở rốn bị ướt , chảy máu là bệnh gì ?	method_diagnosis
Tại sao ăn nhiều cơm lại mệt sau khi uống thuốc điều trị HP ?	cause
Uống bia chung ly với người từng bị lao phổi có nguy cơ nhiễm bệnh không ?	method_diagnosis
Tuổi 18 thủ dâm nhưng không thể xuất tinh liệu có đáng lo ngại ?	severity
Trẻ sơ sinh 3 tháng tuổi đi ngoài 1 lần / tuần có bình thường không ?	severity
Thưa bác sĩ , bệnh vẹo cột sống khởi phát sớm có dấu hiệu nhận biết như thế nào ạ ?	method_diagnosis
Điều trị và chăm sóc bệnh nhân viêm loét dạ dày hành tá tràng	treatment
Thường xuyên mệt mỏi , kinh không đều cảnh báo điều gì ?	method_diagnosis
Trẻ dưới 12 tháng chưa mọc răng kèm biểu hiện sốt nhẹ có nên đi khám ?	method_diagnosis
Nên làm gì khi trẻ hay chảy máu cam ?	treatment
Sản dịch sau sinh ra ít kèm nhầy là vì sao ?	cause
Đau thắt lưng trái có phải dấu hiệu suy thận ?	method_diagnosis
Hỏi đáp : Nổi hạch góc hàm , vòm họng có mụn trắng là dấu hiệu bệnh gì ?	method_diagnosis
Trẻ đã hơn 12 tháng tuổi chưa bắt đầu nói có sao không ?	severity
Thai phụ bị thuỷ đậu nên làm gì để tránh lây bệnh cho em bé ?	treatment
Đặt thông tiểu có phải đặt suốt đời ?	method_diagnosis
Quan hệ vào ngày quên uống thuốc tránh thai có mang thai hay không ?	method_diagnosis
Chướng bụng dưới dù ăn rất ít , khó tăng cân , mệt mỏi là dấu hiệu bệnh gì ?	method_diagnosis
Tuyến giáp phản âm kém , tăng tưới máu có nguy hiểm không ?	severity
Người tiểu đường có uống được nước ép táo với cà rốt không ?	method_diagnosis
Trẻ hơn 1 tháng tuổi tiêm phòng lao được không ?	treatment
Hậu quả biến chứng của bệnh mạch vành là gì ?	severity
Trẻ nhỏ mắc vàng da ứ mật có nguy hiểm không ?	severity
Phẫu thuật cắt bao quy đầu có ảnh hưởng đến kích thước “ cậu nhỏ ’ ’ không ?	method_diagnosis
Đau đầu , suy nghĩ lung tung dấu hiệu bệnh gì ?	method_diagnosis
Chỉ số PSA như thế nào sẽ cần sinh thiết tiền liệt tuyến ?	method_diagnosis
Bé 14 tháng bị sâu 2 răng liệu có vấn đề gì không ?	severity
Điều trị viêm cuống răng có đau không ?	treatment
Dùng thuốc điều trị thiếu máu do thiếu sắt như thế nào không bị dư sắt ?	treatment
Đau nhói 2 bên mang tai là do đâu ?	cause
Sưng đỏ , mưng mủ tại vết tiêm có phải phản ứng bình thường không ?	method_diagnosis
Ăn uống khó tiêu kèm theo khó chịu bụng là bệnh gì ?	method_diagnosis
Trẻ 7 tuổi thường chóng mặt kèm đau đầu dấu hiệu bệnh gì ?	method_diagnosis
Nổi hạch to sau gáy là dấu hiệu bệnh gì ?	method_diagnosis
Trẻ 4 ngày bỏ ăn chỉ uống sữa là dấu hiệu bệnh gì ?	method_diagnosis
Người bệnh cần lưu ý gì trước ngày phẫu thuật ?	method_diagnosis
Tiêm kháng sinh nhiều có ảnh hưởng gì đến sức khoẻ và sự phát triển của bé không ?	severity
Tử cung hai sừng có thể mang thai không ?	method_diagnosis
Các tỷ lệ % EF trong siêu âm tim có chuẩn xác để phát hiện suy tim không ?	method_diagnosis
Bị viêm giác mạc mắt liệu điều trị khỏi không ?	treatment
Xương gò má gãy có tự lành được không ?	method_diagnosis
Bổ sung canxi cho bé bị còi xương trong bao lâu ?	treatment
Không gập được đầu gối điều trị như thế nào ?	treatment
Đau ngực , khó thở kèm hoa mắt và hay đổ mồ hôi liệu có vấn đề gì về tim không ?	method_diagnosis
Thời gian tối thiểu để tiêm phòng dại sau khi bị chó cắn bao lâu ?	method_diagnosis
Sau quan hệ xuất hiện dịch nhầy kèm máu là dấu hiệu bệnh gì ?	method_diagnosis
Trẻ bị đỏ , bong tróc da , loét hậu môn và dương vật nổi bọng nước nên làm gì nhanh khỏi ?	treatment
Các phương pháp điều trị táo bón ở trẻ sơ sinh	treatment
Đại tiện ra máu , đau rát dữ dội là bệnh gì ?	method_diagnosis
Bị nhiễm vi khuẩn lao cần điều trị như thế nào ?	treatment
Nghẹt mũi kéo dài nhưng không có dịch là dấu hiệu của bệnh lý gì ?	method_diagnosis
Thời điểm thích hợp mổ bệnh ngón tay lò xo ở trẻ em	method_diagnosis
Cần làm gì khi tình trạng đau răng lan đến cổ và đầu ?	treatment
Hỏi đáp : Ho kéo dài hay tái phát có phải triệu chứng trào ngược dạ dày ?	method_diagnosis
Thụ tinh nhân tạo IUI cần làm xét nghiệm gì ?	method_diagnosis
Triệu chứng đau đầu phần trên kèm theo đau cổ họng là bệnh gì ?	method_diagnosis
Trẻ sơ sinh bú ít , biếng ăn có phải do thiếu chất không ?	cause
Tại sao đã tiêm vacxin cúm mũi 2 mà vẫn bị cúm ?	cause
Có thể uống thuốc Oresol và Panadol cách nhau 2 tiếng không ?	method_diagnosis
Siêu âm tuyến giáp về bị đau tức nhân có sao không ?	severity
Mũi phế cầu thứ 2 có thể tiêm sau mũi đầu 3 tháng không ?	method_diagnosis
Khó căng cơ nửa mặt , tay yếu dần liệu có phải tai biến không ?	method_diagnosis
Xin bác sĩ cho lời khuyên để phòng bệnh Ung thư đại trực tràng ?	method_diagnosis
Trẻ sơ sinh sốt dai dẳng trong thời gian dài là triệu chứng bệnh gì ?	method_diagnosis
Phương pháp dùng ống thông nội mạch mổ tim là như thế nào ?	treatment
Tim đập 48 nhịp / phút kèm đau nhói và khó thở điều trị như thế nào ?	treatment
Trẻ sinh non 36 tuần có nên bổ sung canxi không ?	method_diagnosis
Cải thiện chiều cao cho trẻ dậy thì sớm như thế nào ?	treatment
Thường xuyên đau mỏi người kèm chướng bụng biểu hiện bệnh gì ?	method_diagnosis
Zona thần kinh có điều trị dứt điểm được không ?	treatment
Viêm tiền liệt tuyến lâu ngày không điều trị liệu có nguy hiểm ?	severity
Bị viêm cục lệ ở mắt nên dùng thuốc nào ?	treatment
Có nên lưu trữ máu cuống rốn để dùng điều trị bệnh ?	method_diagnosis
Mắc suy giãn tĩnh mạch nên điều trị thế nào ?	treatment
Hỏi đáp : Triệu chứng đau đầu Migraine là gì ?	method_diagnosis
Người bị huyết áp thấp thường xuyên tức ngực , khó thở khi đói nguyên nhân do đâu ?	cause
Xuất hiện khối thịt nổi gần hậu môn có phải bệnh trĩ không và nên điều trị thế nào ?	treatment
Khó thở và ho nhiều do xẹp phổi điều trị như thế nào ?	treatment
Tiếp xúc gián tiếp , vi khuẩn HP dạ dày có lây không ?	method_diagnosis
Kết quả xét nghiệm HbC1C 7.0 có cần điều trị không ?	treatment
Bố mẹ có hồng cầu nhỏ thì con có nguy cơ mắc bệnh tan máu bẩm sinh không ?	method_diagnosis
Hạch lành tính bao lâu mới biến mất ?	method_diagnosis
Có nên uống tam thất khi bị bướu đa nhân tuyến giáp không ?	method_diagnosis
Những yếu tố nào ảnh hưởng đến khả năng làm tổ của phôi ?	method_diagnosis
Mẹ nên bổ sung dưỡng chất nào giúp hạn chế tình trạng khô đa khớp ở trẻ ?	treatment
Thường lẩm bẩm nói chuyện một mình là dấu hiệu bệnh gì ?	method_diagnosis
Thiểu sản phổi trái kèm theo xơ phổi điều trị như thế nào ?	treatment
Kết quả xét nghiệm Free T4 và TSH có ý nghĩa gì ?	method_diagnosis
Tiêm phòng dại sau khi bị chó cắn có nguy cơ mắc bệnh dại không ?	method_diagnosis
Trẻ sơ sinh 7 tháng đi ngoài phân đen sau khi uống sữa công thức	method_diagnosis
Chó cắn sau 2 ngày có cần tiêm phòng dại không ?	method_diagnosis
Vòm họng đỏ , tiết nhiều nước bọt là bị sao ?	method_diagnosis
Trẻ mắc bệnh thuỷ đậu mẹ cho con bú nên kiêng ăn gì ?	method_diagnosis
Người cao tuổi bị hẹp đĩa đệm uống thuốc không khỏi phải làm sao ?	treatment
Đau bụng từng cơn , đầy hơi , tức bụng khi no là dấu hiệu bệnh gì ?	method_diagnosis
Buồng trứng đa nang ở tuổi 17 có sao không ?	severity
Bong võng mạc có chữa được không ?	treatment
Khó ngủ , không ngủ được có phải do ảnh hưởng của chất kích thích không ?	cause
Trẻ bị sốt chân tay lạnh kèm đầu nóng nên làm gì ?	treatment
Tê phù và yếu hai chân là dấu hiệu bệnh bại liệt chân tay ?	method_diagnosis
Trẻ bị rướm máu khi đi ngoài có phải nứt kẽ hậu môn ?	method_diagnosis
Sau phẫu thuật cắt đoạn đại tràng vô hạch bé ăn kém , són phân phải làm sao ?	treatment
Ngưng thở khi ngủ là bệnh gì ?	method_diagnosis
Có thể vận chuyển huyết thanh kháng viêm gan B HBIg đường xa không ?	method_diagnosis
Xuất hiện cơn đau tức ngực thoáng qua là dấu hiệu bệnh gì ?	method_diagnosis
Phải làm sao để nhổ răng sâu số 7 và 8 khi bị sốc thuốc tê ?	treatment
Mất tập trung , lơ mơ ở người đeo kính là do đâu ?	cause
Đi ngoài ra máu là hiện tượng gì ?	method_diagnosis
Tuần trước sau khi va chạm với đồng nghiệp khi chơi bóng chuyền , tôi bị tê buốt vai , cơn đau kéo dài hàng tuần , tôi muốn hỏi trật khớp vai có những biểu hiện như thế nào ạ ?	method_diagnosis
